{
  "collisions": [],
  "global_exclusivity_established": false,
  "incomplete_files": [],
  "malformed_seed_fields": [],
  "reserved_seeds": [
    1720100,
    1720101,
    1720102,
    1720103,
    1720104,
    1720105,
    1720106,
    1720107,
    1720108
  ],
  "roots": [
    {
      "eligible_json_file_count": 232,
      "path": "/home/l2nguyen/5g-nr-channel-condition/docs/research/results"
    }
  ],
  "scan_scope": "regular single-link .json and .json.gz files under supplied roots",
  "scanned_file_count": 232,
  "scanned_files": [
    {
      "byte_count": 15522,
      "collision_count": 0,
      "path": "docs/research/results/caez-cross-environment-summary-forecast.json",
      "sha256": "2697498a6309a4c6fe16a8d11b3e397ae5db62b2bd604558c45d0b79726dd345"
    },
    {
      "byte_count": 2328,
      "collision_count": 0,
      "path": "docs/research/results/caez-indoor-audit.json",
      "sha256": "ca241335c191af74aead8bf5fbc3adfcd688ab8f099c7a190f6a705274741285"
    },
    {
      "byte_count": 6533,
      "collision_count": 0,
      "path": "docs/research/results/caez-indoor-magnitude-forecast.json",
      "sha256": "0d892aebd2fd18438cf885011fc1598ffe987624f5a80b0de0f3d4b5a2b7cb6c"
    },
    {
      "byte_count": 4032,
      "collision_count": 0,
      "path": "docs/research/results/caez-official-count-reconciliation-20261024.json",
      "sha256": "be03f71fd056f0dfe4b6f2a06c5dc76458000e1e68f2beb0723e863dfdf53cd0"
    },
    {
      "byte_count": 19821,
      "collision_count": 0,
      "path": "docs/research/results/cdl-profile-validation-19.2-a-to-e-4096-seed31900-1000ns.json",
      "sha256": "03e753b8d4074831499718a66fdef64ebf10e003868bd18d6a20038c14229c14"
    },
    {
      "byte_count": 19831,
      "collision_count": 0,
      "path": "docs/research/results/cdl-profile-validation-19.2-a-to-e-4096-seed31900-300ns.json",
      "sha256": "21c8ddaee69bafdf5404587b1a9d6534dd36dc5d1ca59cf84dda39c55dcae8a2"
    },
    {
      "byte_count": 19838,
      "collision_count": 0,
      "path": "docs/research/results/cdl-profile-validation-19.2-a-to-e-4096-seed31900-30ns.json",
      "sha256": "cb994c00b61bd48bf9784f2821b497fc1ac23b9240aaccebc469129ebf68b489"
    },
    {
      "byte_count": 19827,
      "collision_count": 0,
      "path": "docs/research/results/cdl-profile-validation-19.2-a-to-e-4096-seed31900.json",
      "sha256": "1c29b597ae04fbd7b370143f1cca98e70efaa805e2090bef2d2d5b60c31db094"
    },
    {
      "byte_count": 4163,
      "collision_count": 0,
      "path": "docs/research/results/g3-fr3-building-scattering-audit-20261024.json",
      "sha256": "5a14154a9cbe7ad386f1ed556b66ac17a3d8944be52038d6445751fc651d5f9f"
    },
    {
      "byte_count": 38573,
      "collision_count": 0,
      "path": "docs/research/results/g3-scene-asset-material-audit-20261023.json",
      "sha256": "b4275ca39801667467004d1b6eb32c6333de4d0fd2256a32fb3adb19010640ef"
    },
    {
      "byte_count": 1239,
      "collision_count": 0,
      "path": "docs/research/results/g4-standard-reference-audit-20261026.json",
      "sha256": "59f58dfa7074c97f365ca49c5539c2e41b61275ac170d4301d5ea5552229d8ee"
    },
    {
      "byte_count": 5476,
      "collision_count": 0,
      "path": "docs/research/results/g5-cp-bounded-dft-selected-failures-20261024.json",
      "sha256": "b5c6bd6338ec3f766e37c64525f816267b4421a119d6488a2020c6855ad6bf00"
    },
    {
      "byte_count": 119398,
      "collision_count": 0,
      "path": "docs/research/results/g5-delay-domain-dft-confirm-20261024.json",
      "sha256": "f924dc226bc5c2611f63c7887943c3eba969c74dde9ddffd6e132e3d4a212956"
    },
    {
      "byte_count": 111684,
      "collision_count": 0,
      "path": "docs/research/results/g5-doppler-dmrs-density-confirm-20261024.json",
      "sha256": "b0f43d2b04a93249147784c77e825eec21fb3de7125f213826cbb15bd2ffd033"
    },
    {
      "byte_count": 112038,
      "collision_count": 0,
      "path": "docs/research/results/g5-doppler-dmrs-density-scan-20261024.json",
      "sha256": "bf6990006d04318ffa9445d63a12303f77488e10bf34baeca4e2d675564898c8"
    },
    {
      "byte_count": 31742,
      "collision_count": 0,
      "path": "docs/research/results/g5-doppler-dmrs-noise-scan-0p0001-20261024.json",
      "sha256": "607424931c89d0493a5618754cf8aa1b0ec1679a7bd67b36fcaaa0a59cd89e6c"
    },
    {
      "byte_count": 31718,
      "collision_count": 0,
      "path": "docs/research/results/g5-doppler-dmrs-noise-scan-0p0003-20261024.json",
      "sha256": "ebdf845b5d272c386bf47d6d5b52363c9f83431ca0866e607b04b50ae1bf84ef"
    },
    {
      "byte_count": 31743,
      "collision_count": 0,
      "path": "docs/research/results/g5-doppler-dmrs-noise-scan-0p0006-20261024.json",
      "sha256": "ff1674c154031edacf04d03825073fa69e6b70825ca49b2eb14a087b83c0b986"
    },
    {
      "byte_count": 78905,
      "collision_count": 0,
      "path": "docs/research/results/g5-doppler-operating-point-scan-20261024.json",
      "sha256": "82f869b297dc3a6ff4716a8c46e1c01952a2d22d63062797865e84824a861633"
    },
    {
      "byte_count": 8452,
      "collision_count": 0,
      "path": "docs/research/results/g5-estimator-choice-posthoc-20261024.json",
      "sha256": "e68b67059ae9b8824e84757adca4f67a35e6d43f5a20cc5c21eeb21b6cae759a"
    },
    {
      "byte_count": 43061,
      "collision_count": 0,
      "path": "docs/research/results/g5-independent-channel-pusch-20261024.json",
      "sha256": "18b72f1206fcb46761077d62252f1500a6ee81a466300c093c8137f7499ab183"
    },
    {
      "byte_count": 78606,
      "collision_count": 0,
      "path": "docs/research/results/g5-independent-channel-pusch-doppler-stress-20261024.json",
      "sha256": "b3a7c37a2ffe6f4c2c3516caeac412be64a6f215dbeac99ff9b2733451d9c4fe"
    },
    {
      "byte_count": 55073,
      "collision_count": 0,
      "path": "docs/research/results/g5-independent-channel-pusch-ici-20261024.json",
      "sha256": "1d0705afc855b1f11f451d005412ad14d363ede882daadbd847c2fbf28912154"
    },
    {
      "byte_count": 242518,
      "collision_count": 0,
      "path": "docs/research/results/g5-ordered-impairments-independent-channels-cpu-64x8-20261024.json",
      "sha256": "ec207cc42c1e4557c997f9123339683052ee870ed364b6e2dfb09b329ea80d7a"
    },
    {
      "byte_count": 242132,
      "collision_count": 0,
      "path": "docs/research/results/g5-ordered-impairments-independent-channels-cpu-64x8-channel-truth-guard-diagnostic-20261024.json",
      "sha256": "bd9d764dbec86f6a1ca32f35266a8fc4a87c00a0f7cb8195c919faae34e0dcb0"
    },
    {
      "byte_count": 243268,
      "collision_count": 0,
      "path": "docs/research/results/g5-ordered-impairments-independent-channels-cpu-64x8-fixed-max-guard-diagnostic-20261024.json",
      "sha256": "31f1226b6c1a2e70d4ae5f2d93ebe889e5d2173c3ef89346dc55ad392a31d08d"
    },
    {
      "byte_count": 242824,
      "collision_count": 0,
      "path": "docs/research/results/g5-ordered-impairments-independent-channels-cpu-64x8-fixed2-guard-diagnostic-20261024.json",
      "sha256": "b5f3f795d726ccecbd91ab14039de7821af6bc684f3f034586e2603afe9a0d40"
    },
    {
      "byte_count": 242658,
      "collision_count": 0,
      "path": "docs/research/results/g5-ordered-impairments-independent-channels-cpu-64x8-shared-sync-confirm-20261024.json",
      "sha256": "509cde92b2682aceebf409a50afad853ac71b33044a2b043a5e14077b474f9f7"
    },
    {
      "byte_count": 260683,
      "collision_count": 0,
      "path": "docs/research/results/g5-ordered-impairments-independent-channels-cpu-64x8-shared-sync-diagnostic-retention-v3-20261025.json",
      "sha256": "a0610a3e5caaa29433c6c96b88b682d9382fc8d34eac6bdda7078e677bf014dc"
    },
    {
      "byte_count": 1607,
      "collision_count": 0,
      "path": "docs/research/results/g5-ordered-impairments-independent-channels-cpu-64x8-shared-sync-diagnostic-retention-v3-audit-20261025.json",
      "sha256": "09702b8b147540f3f79d1f445e076573a4dd426e68d2b03bd208eb4ab069f20f"
    },
    {
      "byte_count": 243057,
      "collision_count": 0,
      "path": "docs/research/results/g5-ordered-impairments-independent-channels-cpu-64x8-shared-sync-replication-20261025.json",
      "sha256": "bb2aeab7376f7e195a95cc5d54cd8ea90a86a865137f4145ed8d159a48bb4b8a"
    },
    {
      "byte_count": 243692,
      "collision_count": 0,
      "path": "docs/research/results/g5-ordered-impairments-independent-channels-cpu-64x8-shared-sync-replication-v2-20261025.json",
      "sha256": "54f4845cd7b9989fbdefa0da393cedf456ee0c35c136aa7711664009c645003a"
    },
    {
      "byte_count": 1523,
      "collision_count": 0,
      "path": "docs/research/results/g5-ordered-impairments-independent-channels-cpu-64x8-shared-sync-replication-v2-audit-20261025.json",
      "sha256": "f858992ecbc803b05f6103ca8e56c016cd2b93bd859baaf130a09fa465fe7e6f"
    },
    {
      "byte_count": 11268,
      "collision_count": 0,
      "path": "docs/research/results/g5-ordered-impairments-tx-rx-iq-cpu-128-20261024.json",
      "sha256": "b889a7f2a9d2f95ab47ccc80a6de5a16840c242d3213347f1aee8865da651812"
    },
    {
      "byte_count": 4649,
      "collision_count": 0,
      "path": "docs/research/results/g5-standardized-pusch-cp-exceedance-20261023.json",
      "sha256": "362a7eea2f5c82a2dae9244fa1fabb96624c93bfd2858a7819cc08b973ca75c0"
    },
    {
      "byte_count": 6101,
      "collision_count": 0,
      "path": "docs/research/results/g5-standardized-pusch-cp-exceedance-cluster-bootstrap-20261023.json",
      "sha256": "247dfcf6581d8628360e01b9b8592bcb8b85d70e11fe36546b15677f75129bde"
    },
    {
      "byte_count": 74783,
      "collision_count": 0,
      "path": "docs/research/results/g5-standardized-pusch-cp-exceedance-snr-curve-128-v5-20261024.json",
      "sha256": "bb7071896453e95f70cf072623da7f431de1ee744f23e573ec8f8110d80733d2"
    },
    {
      "byte_count": 19673,
      "collision_count": 0,
      "path": "docs/research/results/g5-standardized-pusch-cp-exceedance-snr-curve-20261023.json",